{
 "id": "2026-09-12-zew-september",
 "aufgeloest": "2026-09-15T19:41",
 "eingetreten": true,
 "beleg": "ZEW-Index der Konjunkturerwartungen fuer Deutschland, September 2026: 34,7 Punkte (Vormonat 34,2). Veroeffentlicht vom ZEW Mannheim am 15.09.2026 um 11:05 Uhr, uebereinstimmend gemeldet von finanzen.ch und finanznachrichten.de. Schwelle der Aussage war 34,0.",
 "anmerkung": "Der von mir am 12.09. notierte Konsens lag bei 34,0 (Trading Economics). Dow Jones erhob 40,0, weshalb die Presse von einer Enttaeuschung sprach. Maßgeblich ist die in der Regel genannte Schwelle."
}
