{
 "id": "2026-09-17-trend",
 "aufgeloest": "2026-09-17T18:06",
 "eingetreten": true,
 "beleg": "Bezugspunkt 29718,25 (Eroeffnung Minutenkerze 15:30). Die Marke 200 Ticks nach unten (29668,25) wurde um 15:34 erreicht. In der Gegenrichtung lief der Kurs nach 15:30 zu keinem Zeitpunkt ueber den Bezugspunkt hinaus; das hoechste Hoch im Fenster war 29718,25, die Marke +100 Ticks (29743,25) wurde nie beruehrt. Tief im Fenster 29605,50, das sind 451 Ticks unter dem Bezugspunkt. NQ M1, fortlaufender Kontrakt, Europe/Berlin."
}
