{
 "id": "2026-09-14-open",
 "aufgeloest": "2026-09-14T16:00",
 "eingetreten": false,
 "beleg": "Kein Level im Fenster 15:30-15:40 erreicht; keine M1-Kerze schliesst 8 Ticks jenseits einer vor 15:30 markierten Linie. Belegt durch den eigenen M1-Chart NQ, aufgezeichnet im Review vom 14.09.2026.",
 "anmerkung": "Die 8-Tick-Schwelle dieser Regel entspricht nicht genau meinem tatsaechlichen Vorgehen; sie wird ab dem naechsten Eintrag praezisiert."
}
